start	end	text
600000	607400	B ocela
616080	622300	acabou assim
625300	627040	inho na tal
627040	633240	Tudo mundo já com a família, reunida para a gente se indiano ou não, ou
633240	636400	as versasinho também, com o PSA vida.
636400	641360	Esporta gente a gente passar a fim de ano com o Espírito de Natal, pensando em que a gente gosta.
641360	649040	E também fazendo com a gente que é para o nosso futuro, porque não, também, falam um pouquinho de dados.
649040	656680	E hoje, a gente tem o nosso último último book aqui, do último desculpa atividade prática.
656680	663080	Da Esprint 3, então a gente vai seguir hoje, principalmente na manipulações de dados avançadas.
663080	669320	Então, a gente vai fazer atividades para as reservas sonadas ao que a gente viu na loteórica de que interfere.
669320	675160	Então, na que a gente tem a gente viu a gente fez uma loteórica, a gente falou bastante sobre manipulações de dados avançadas.
675160	677080	E hoje, a gente vai trazer elas na prática.
677080	679640	Então, a gente vai fazer essas manipulações de dados.
679640	685800	A gente vai novamente usar aquilo colab, vou até ligar ele aqui, para a gente usar o longo da aula.
685880	687400	Então, aumentada.
687400	694600	E aí, daí hoje, eu usalpando os que a nossa principal ferramenta de manipulações de dados ali, adorando um pai,
694600	696760	que a gente vai fazer algumas operações com ele.
696760	703000	Mas também, eu vou mostrar para vocês uma forma de indicar a regardados, que a gente vai usar bastante que não go de tempo.
703000	705400	Com o C-born, então, que é o C-born.
705400	709160	O C-born é uma biblioteca para análise básicamente estatística de dados.
709160	714120	Então, ele também tem também gráficos, mas são gráficos mais voltados para análise estatísticas.
714440	719960	Então, ele é construído em cima da gente pode livre, mas ele traz uma análise estatísticas ali,
721160	724440	visuais já voltadas para análise de dados.
724840	731800	Então, essa é uma vantagem do C-born, e ele tem um método dentro deste lado, de data set, que ele já traz da data set carregados.
731800	734760	Então, isso é muito bom, e são data set bons para a gente mostrar.
734760	737400	Eles estão a gente as manipulações avançadas, que a gente vai trazer hoje.
738840	741000	Então, aqui, primeiro passo, vamos rodar isso.
741080	745640	E a gente basta trazer, longe da data set, a gente passa para a gente stringe com o longo data set, que a gente tem.
747400	751800	Então, aqui, a gente tem um parâmetro de chips, que é a Prundata set de gorjetas, o parâmetro.
753320	761240	Se a esse que é a Prundata set de gelo e para o método taxis, que é para um data set de viagens de taxes.
761240	765400	Então, vamos ver como é que fica cada um desses, que é o três-seguimento que é o meu rapigenco.
766360	772920	O de gorjetas, que a gente tem total da conta, uma coluna de gorjeta, o sexo masculino feminino,
772920	780120	o seu pessoal é fumante ou não, o dia da semana, na esçã, deimanda em inglês, o tempo, na era moço, o café da maior gigantar.
780920	785640	O tamanho, provavelmente, era número de pessoas na mesa, e é isso que tem aqui no gorjetas.
787000	792280	Vamos morirado no info, não tem nenhum valor faltante, aparentemente, são uns uns uns 44,
792520	796360	colunas, uns 44 linhas, então, a gente tem aqui, uns 44 linhas de gorjetas.
797080	801880	E, é isso, né, a gente tem 4 variables categoricas, boas variáveis, por último, uma variável inteira,
801880	808760	que é aqui, noiro de pessoas a inteiras, por último, são total da conta de gorjetas, e as categoricas são essas quatro aqui.
811000	821240	Em beleza da molyada, no describe, aqui a gente tem o total da conta, né, a média de 20 dólares, por conta,
821240	827320	uns iupadrão ali de 8 dólares, o mínimo de 3 dólares, a conta mais barata, então, deu 3 dólares,
827320	833160	com nossa mediana, foi em 17, então, o próximo da média, e a conta mais favorable, deu 50 dólares.
834760	839720	Ora, falando de gorjetas, a gorjeta média foi 3 dólares, então, ali, de 15%,
839720	847080	na United States, em 19,5%, ao padrão, uns iupadrão de 18, 8, o gorjeta mínimo foi 1 dólares,
847240	853000	hoje, é uma máxima 10 dólares. Então, aqui, o tamanho, né, o saiz, o quantidade de pessoas,
853000	859240	a média, 2 pontos, com 66 pessoas por mesa, quando os iupadrão de 19,5, ali, o mínimo era 1 pessoa,
861400	869560	o máximo era 6 pessoas no mês. Então, beleza, agora, vamos ver o taxi, acho que a gente não tem ele aqui,
869560	876760	vamos mostrar carinha dele. O taxi se é esse aqui, então, a gente tem a data da...
876760	881400	E a pessoa foi pega a data da entrega, na data que ela foi que chegou, no mês de passageiros,
881400	886280	a distância, e per... é o custo daquela viagem, tipo, gorjeta, toça, no ingresso,
886280	892200	onde o tuputarífas adicionais, total, né, o valor total, somando esses 3,5 anos no maery,
892200	897240	que o secorro do taxi, o tipo de pagamento azul, na então, a região do bairro,
897240	906280	né, do que foi a coleto, bairro da entrega, na desculpa, a zona da entrega, zona da coleto, da entrega,
906280	910760	e o bairro da entrega da entrega da coleto, aqui, marata, então, o índice Bronx,
910760	916040	tiver que fulsar os bordos, os distritos de Nova York.
917880	924120	Dando um discréi, me, olha aqui que legal, quando a coluna tá com tipo de data,
925080	929960	a média, ela traz justamente o ponto, ponto média da data, né, então, dos esses 6 do 3 ali,
930760	934040	então, aqui, para a entrega, esses 6 do 3, 2019.
934040	938200	Aqui a gente vê, né, é o mínimo, a primeira data foi 28 de 12, e a última data foi,
938200	944360	tem um do novo, pela data sim, dá pra ver, que foi basicamente as viagens de...
945480	948840	março, né, provavelmente as viagens de março, de...
948840	954920	ouzeais que foram encerradas, ouzeais que até as viagens que começaram em março de 2019,
955320	959560	a gente tem aqui, para entrega isso também, e tinha o último viagem que acabou,
959560	964440	em abril, mas é isso, é, provavelmente, são as viagens de março de 2019.
966120	970520	No último passageiro, dá mais de 1,5,5,3, o máximo 6,5,5,5,5,5,
970520	974840	provavelmente era aqueles escados maiores, né, a distância, a gente teve aqui distância zero,
974840	979240	ele, provavelmente, tem alguma coisa errada, né, aqui, mais enfim.
979240	984200	50% a mediana, aqui, então, 1,64 quilômetros, a média 3,12,
984200	986920	a gente fica que já tem... é uma instrução, provavelmente, da mente,
986920	991320	deitas as suas longas, né, exatamente, e aqui, a gente veio 37 quilômetros.
991320	994760	E o custo foi média 13 dólares,
995400	1002840	os 50% aqui, em nove, 50 e o máximo 150, né, a viagem mais cara foi 150 dólares.
1002840	1007800	Então, a gorjeta aqui, máximo 33 dólares, a mínima nada,
1007800	1013880	e o total, a viagem mais cara, saiu 100,7,4 dólares no total.
1016200	1020440	Então, é isso, né, do taxi, e agora vamos ver o siai, esse, né, bom,
1020440	1023240	a gente dá uma olhadinha, ele também, que a gente vai trabalhar com ele também.
1023240	1028120	E o siai está um data sete bem simples, o boté de gelo, né,
1028520	1034200	o gelão dá até 6 bem simples, ele tem somente a data,
1034200	1042760	aqui, a data, basicamente, tem uma linha para cada data, desde 1980 até o finalzinho de 2019.
1042760	1046800	E é existente, é, a quantidade de gelo, enfim, de gelo,
1046800	1049560	nas perfeícias do mar na planta terra.
1049560	1053400	Então, a gente vai ver algum grudo tempo como flutou, então, ele tem somente luz,
1053400	1056960	duas colunas, esta data, franho, né, a data, e a quantidade de gelo,
1056960	1062960	um planta terra. Então, durante o valor dele, é as 13 milinhas que são 13 mil dias ao longo desse
1062960	1068320	tempo, e ele tem justamente a quantidade de gelo, para cada um de de esses gelos,
1068320	1072800	a gente consegue analisar o comportamento do gelo, na nosso perfil de mar da terra,
1072800	1075840	longo desse, enfim, basicamente, 40 anos.
1077120	1080960	Primeiro passo, lembra em que a gente viu como a gente pode usar funções
1080960	1084080	para manipular com os notos de dados e automates a tarefa,
1084080	1087520	que a gente vai fazer várias vezes. Então, vamos se pouca a gente tem esse data saída de
1087520	1092480	gorjeta, e todo mês a gente faz uma manipulação ali, para clasificar o nível de
1092480	1096480	gorjeta, né, então a gente vai pegar aqui, criar uma funçãozinho, para dizer se a gorjeta
1096480	1099600	é alta, baixo, a média. Então, o que é que a gente vai fazer, a gente vai criar
1099600	1103680	a função, chamar de clasque, agurgitas, ela vai receber um paramilito total
1103680	1107920	bio, que é o valor total da conta, e a gente vai jogar aqui, se esse valor total,
1107920	1115440	foi o maior do que 30, a gente vai retornar a auto, se ele foi entre 20 e 30, a gente vai retornar
1115440	1122240	mais, se não, né, o else, que aqui, basicamente, é menor do que 20, ele vai retornar,
1122240	1126080	baixo. Então, o que a gente faz, a gente vai aplicar, lembra que a gente botou o
1126080	1130400	a gente, que se não como que faz o apply, não vai classificar a gorjeta, que o padrão do
1130400	1135360	apply é botar no nível de coluna mesmo, e a gente vai passar a função classificar a
1135360	1138640	gente, então, a gente vai criar uma nova coluna chamada nível gorjeta,
1138640	1142800	a gente vai pegar a partir do total bio, então, o total bio ele vai entrar aqui,
1142800	1146320	e vai ser a gente paramilita para a gente fazer esse classificação.
1146320	1153200	Quando a gente fiativa aqui, olha o que acontece, já está classificado o nível daquela gorjeta.
1155440	1158160	Próximo passo, agora vamos fazer aqui um abruparamento com as gorjetas,
1158160	1164480	para ver como que elas compota uma um dos dias da semana, a gente tem aqui o dia,
1164480	1167360	a gente botou o velho grupo a gorjetas, na das nossas outras pessoas,
1167360	1171360	um gata frame com o jeito, esse tipo de velho grupo a pude, e não agregador,
1171360	1175040	a gente vai pegar o total da conta, e do total a gente vai pegar a leção de
1175040	1180880	lapação ali, se você vai pegar a média e a soma, e na gorjeta de tip,
1180880	1185840	a gente vai pegar a soma, a contagem e a média. Então, olha essa
1185840	1190800	clagal, a gente vai pegar a média e a soma do total bio, olha aqui,
1190800	1193360	pude da semana, olha, pode ver que é uma gente no sábio de um domingo,
1193360	1197200	as imagens das gorjetas são maiores. E a soma está lá,
1197200	1199680	a gente pode ver que se esta feira, é o total,
1199680	1204880	eu desculpa, o total do dos gorjetas, não, ele é maior,
1204880	1207920	aqui a gente vem pela média, não sábio de um domingo, as gorjetas saem de
1207920	1212400	277, vão para 2,993, 25, mas essa acontece também,
1212400	1215040	porque as contas ficam as caras no final de semana,
1215040	1219440	e a gente vê que pelo total, 87, 36 no final de semana,
1219600	1224320	e 62,99, bem menos o volume, nos dias que não são final de semana.
1224320	1226400	Então, aqui a gente já conseguiu fazer um agrupamento,
1226400	1230240	e se a gente quiser se fazer um segundo agrupamento, eu poderia vim aqui no grupo P.
1230240	1233280	Então, eu vou agrupar além do bem, eu vou botar por
1233280	1235600	time.
1235600	1239360	E olha o que acontece, ele agora pega por a moça e jantar,
1239360	1241920	em um sábio da parentemente, não funciona o promosso,
1241920	1244960	quando tem nenhuma entrada, a gente já descobri isso aqui agora.
1244960	1246720	Mas a gente pode ver, eu quer se contas, do amor,
1246720	1248400	vou sopar a gente mente na sexta,
1248400	1251040	eu sou bem mais barato do que eu jantar.
1251040	1255040	E na terça, bem parecido, apesar de só ter uma entrada aqui por jantar,
1255040	1259520	então, estranho, que tem um jantar, um uma entrada por jantar na terça.
1259520	1262000	Mas enfim, a isso que a gente consegue fazer com o web de pomens,
1262000	1263440	a gente pode passar aqui dentro do grupo P.
1263440	1265680	O que a gente quer botar no agrupamento,
1265680	1267120	e seguir a gente faz o agregador,
1267120	1270000	e mostrar o que a gente quer levar no agregador,
1270000	1272000	e quais as funções que a gente quer levar para ela.
1272000	1273760	Então, a gente dá a pica na média,
1273760	1276480	e a soma aqui é a soma contagem a mente,
1276480	1279680	para cada uma dessas duas columnas, chip e total bem.
1281920	1285440	Em seguida, vamos passar agora por função exlando da...
1285440	1287280	As funções lando das permite,
1287280	1290080	que a gente viu aplicar operações simples em uma linha de cor,
1290080	1294240	então a gente consegue definir funções sem o def,
1294240	1295760	sem a palavra de escada def,
1295760	1298560	então a gente consegue definir as funções em uma linha de cor,
1298560	1299680	e a gente vai fazer isso aqui,
1299680	1301200	não só uma, por exemplo,
1301200	1303920	aquelas três columnos no mérito que as lados taxa,
1303920	1305680	a gente vai somar em um só,
1305680	1306560	como que a gente vai fazer isso,
1306560	1307840	a gente vai dar uma plai,
1307840	1309440	e a gente vai, novamente,
1309440	1310720	a plai a gente dá para a funções,
1310720	1313520	só que a gente vai definir a função dentro do apply,
1313520	1315040	então a gente vai jogar um âmbida,
1315040	1316560	então para cada linha,
1316560	1320160	a gente vai somar o fér, o chip e o tos,
1320160	1322240	e aqui a gente vai passar um áxis igual,
1322240	1324080	porque a diferente do que ele lá,
1324080	1325520	a gente é precoa, a nível de cor,
1325520	1328640	não é que a gente vai aplicar a x-1, a nível de linha.
1328640	1331040	Então, com isso, olha o que acontece,
1331360	1334480	ele vai pegar por que por si é que se eu Zoom ele nem difícil que a linha,
1334480	1336480	e faz a soma desses três columnos,
1336480	1338000	gerando o somo total viagem,
1338000	1339520	o que que o somo total viagem em vira,
1339520	1344400	ele vira uma série com o somba da total,
1344400	1347280	soma total viagem para cada linha,
1347280	1349360	então a gente vai ter que ir,
1349360	1351840	para cada linha a gente tem o somo total daquela viagem,
1351840	1355200	então basta depois atribuir isso,
1355200	1357760	a nova coluna chamada a soma total viagem,
1357760	1360400	aqui era o nosso determinante frem, perfecto,
1360400	1364320	e com isso a gente consegue adicionar ela,
1365280	1367680	outra coisa aqui, por exemplo,
1367680	1370320	a gente vai pegar e vamos aplicar, por exemplo,
1370320	1374000	como a gente pode usar dentro do índice em filtro,
1374000	1375520	aqui a gente vai aplicar um filtro,
1375520	1377040	eu posso colocar o apply,
1377040	1380480	o lâbida de x, x igual a marata,
1380480	1382720	então dentro do aplicar boro,
1382720	1385200	eu vou aplicar o apply para pegar x,
1385200	1386960	o que só que foi uma rata,
1386960	1388400	então aqui eu consigo filtrar ela,
1388400	1389840	toda vez que o nosso data frem também,
1389840	1392080	esse é um outro modo de fazer afiltragem,
1392080	1393440	e aqui ele vai vir, por exemplo,
1393440	1395040	ele veio três, porque a gente deu a reestrei,
1395040	1398640	mas tem, provavelmente, mais de índice em marata,
1398640	1399920	mas essa ideia,
1399920	1402880	aqui a gente pode pegar a coluna e aplicar dentro dela um filtro,
1402880	1406720	para justamente pegar o valor que a gente quiser.
1407840	1409840	Seguir a gente pode também criar uma nova coluna,
1409840	1410960	lembra do filtro indirir,
1410960	1412080	que a gente viu,
1412080	1413920	a gente pode também fazer isso,
1413920	1415760	aqui, no caso, não enxerga a ser fatim indiria,
1415760	1417440	e está muito mais agitando,
1417440	1420640	aqui, apenas, a gente vai basicamente traduzir.
1420640	1423120	Ó, a gente vai aplicar para cada linha,
1423120	1425680	se o pagamento indiria,
1425680	1428000	a gente vai criar o valor vai ser pagamento indiria,
1428000	1429440	se a linha foques,
1429440	1430720	se não pagamento de cartão,
1430720	1433280	são essas duas falsas, tem um anjero e cartão,
1433280	1434640	que eu acredite de cartão,
1434640	1435520	e que é isso.
1435520	1437520	Então, a gente vai botar o foques,
1437520	1438960	ele vai virar pagamento de e-mail,
1438960	1441120	se não vai virar pagamento de cartão.
1441120	1443040	E com isso, a gente consegue aterar
1443040	1444080	todas as colunas lá,
1444080	1445280	então aqui o lábida,
1445280	1446960	e pode julgar bem em versátil,
1446960	1450960	para fazer essas operações mais simples.
1452640	1453520	E agora, acho que,
1453520	1455600	em das partes mais legais da aula,
1455600	1457600	vai trabalhar aqui com o Indofunction,
1458400	1459680	funções de janeu,
1459680	1461440	então, a gente vai usar a média móvel,
1461440	1462320	o ranking, comparação,
1462320	1463600	vai ficar bem claro,
1463600	1466880	usando o data set Gil,
1466880	1468320	então, que nem ele te viu,
1468320	1471840	o Gil, ele é o data set de 40 anos de distensão
1471840	1475120	da o Gil, la camada da superfície do mar,
1475440	1476880	e com isso,
1476880	1478880	o Gil já era valor,
1478880	1480080	é a série histórica,
1480080	1480720	ao longo tempo,
1480720	1482400	ele tem 40 anos de formação.
1482400	1483760	Mas, o primeiro coisa,
1483760	1486080	a gente lembra da média móvel da pandemia,
1486080	1487280	ali para ver,
1487280	1488560	nos últimos 90 dias,
1488560	1490400	qual é a média móvel de casa?
1490400	1491920	Aqui, isso, com a média móvel,
1491920	1492880	basicamente, ela segue,
1492880	1493920	para criar um entendência,
1493920	1494720	mas,
1494720	1495360	é,
1495360	1495840	podemos dizer,
1495840	1497360	se mais robusto dos dados,
1497360	1499120	e quando eu tô olhando 90 dias para trás,
1499120	1500160	eu tô pegando um histórico bem,
1500160	1500720	mas,
1500720	1502320	robusto do que é um indudio,
1502320	1503040	ou uma semana,
1503040	1503760	perfeito?
1503760	1504400	Então,
1504400	1505520	é, com isso, eu consigo analisar,
1505520	1506240	será que tá subindo,
1506240	1507360	será que tá desse ano?
1507360	1508960	Porque é dependendo do restado de ontem,
1508960	1509920	dia de ontem,
1509920	1511680	pode ser que tem um influência ali,
1511680	1513440	mas, quando a gente olha no vento de as patrais,
1513440	1514640	acaba que fica,
1514640	1515840	é o peso maior,
1515840	1516880	porque realmente tá acontecendo
1516880	1518480	nesse período de 3 meses.
1518480	1520000	Então, aqui, a gente vai fazer a mesma coisa,
1520000	1522080	na média móvel dos 3 meses,
1522080	1523680	para a colombia de extenshete,
1523680	1524720	certo?
1524720	1525760	E a gente vai botar
1525760	1527760	os a fazer isso usando o metro do rol,
1527760	1528720	então, a gente vai pegar a gela,
1528720	1530240	a extenshete, que é essa colunque,
1530240	1531600	vai aplicar o metro do rol,
1531600	1533360	como a janela de 90 dias,
1533360	1535360	pegando a média, então,
1535360	1536720	a gente se guide botar o agregador,
1536720	1538480	e a gente consegue,
1538480	1540000	a média.
1540000	1542000	Em seguida,
1542000	1542960	a gente vai fazer,
1542960	1543760	para o rânsque,
1543760	1546560	o rânsque com o metro do mínimo,
1546560	1548240	ele faz exatamente
1548240	1549920	um rânsqueamento de cada linha,
1549920	1551840	ou seja, dentro das 3 milinhas
1551840	1553200	lá do data frame,
1553200	1555120	em que lugar em que posição rânsque
1555120	1555760	literalmente,
1555760	1556720	tá aquela linha,
1556720	1558320	e aqui, quando a gente bota mim,
1558320	1560000	ele vai do,
1560000	1560800	o menor,
1560800	1561840	é o primeiro rânsque,
1561840	1563120	ou seja, que a gente vai menos gelo,
1563120	1564960	vai ser o primeiro no rânsque.
1565760	1567760	Então, olha como a técnica fica aqui.
1569120	1570400	No começo aqui,
1570400	1571600	a média móvel,
1571600	1572640	tem valores no uso,
1572640	1573360	porque, naturalmente,
1573360	1575200	não tinha noietadias ainda no história,
1575200	1576320	certo?
1576320	1577760	Mas a partir daqui,
1577760	1578640	a gente pode ver,
1578640	1579600	na colunque no botar,
1579600	1580400	que não ventei um,
1580400	1581840	assim,
1581840	1582640	se eu pegar aqui,
1582640	1584000	o do 80,
1584000	1584800	sim,
1584800	1585280	realmente,
1585280	1586800	não vai ter,
1587680	1588160	aqui,
1588160	1589840	então, a gente pode ver a partir do dia 89,
1589840	1590400	que ele já tinha no meu
1590400	1591280	tedeza no história,
1591280	1592640	que ele começou a consolidar
1592640	1593840	a média móvel.
1593840	1595040	E que me a gente viu aqui,
1595040	1595440	rânsque,
1595440	1597440	é justamente que posição,
1597440	1598080	no rânsque,
1598080	1599840	das 13 mil linhas,
1599840	1600720	tá,
1600720	1602720	é aquela linha.
1603920	1605120	Então,
1607680	1609120	é isso que a gente consegue ver,
1609120	1610560	a gente pode ver que os dias atuais,
1610560	1611280	eles estão
1611280	1613440	um rânsque bem menores,
1613440	1614240	ou seja,
1614240	1615680	tem menos gelo,
1616800	1617680	aqui,
1617680	1619200	do que os dias anteriores,
1619200	1620400	que estão bem lá em cima,
1620400	1621920	próximo do dos menores,
1621920	1623120	dos menores no rânsque,
1623120	1623920	que me não é só dataçais.
1625360	1626560	Outra coisa que interessante
1626560	1628320	é fazer uma comparação,
1628320	1629600	botar uma comparação dentro
1629600	1630880	da mesma linha.
1631680	1632640	Então, aqui com o extente,
1632640	1634080	quando o boto shift 30,
1634080	1634880	ele pega,
1634880	1635920	qual que era aquele valor,
1636560	1637040	do seja,
1637040	1638000	da colunque extente,
1638000	1639040	30 dias atrás,
1639440	1640400	aqui o padrão,
1640400	1640880	ao indo,
1640880	1641760	na janela,
1641760	1642800	é 30 dias.
1643120	1643600	Então, com isso,
1643600	1645120	eu consigo fazer comparações,
1645120	1645760	ter feito,
1646160	1646720	olha aqui,
1647680	1648640	no começo aqui,
1648640	1649040	claro,
1649040	1650080	não tinha 30 dias para trás,
1650080	1650640	mas aqui,
1650640	1651840	eu estou olhando aqui,
1651840	1652800	eu tinha 12 mil,
1652800	1654480	quando eu olho 10 dias para trás,
1654480	1655360	desculpa.
1655360	1656480	30 dias para trás,
1656480	1657360	porque a gente botou para
1657360	1658160	30 aqui,
1658640	1659680	a gente tinha 10 mil,
1659680	1660640	que é 42.
1661120	1661840	Então, com isso,
1661840	1662720	a gente consegue comparar
1662720	1663360	a item de ideia.
1663360	1663760	Então,
1663760	1664480	eu consigo inclusive fazer
1664480	1665040	uma coluna aqui,
1665040	1665680	de comparação,
1665680	1666640	na conta que cresceu,
1666640	1668240	os últimos 30 dias cada
1668240	1668640	menino.
1670160	1671040	E a gente pode fazer
1671040	1671360	isso,
1672320	1672800	claro,
1672800	1673440	nessa gente estava
1673440	1674160	de usando 30 dias,
1674160	1674720	a gente pode fazer
1674720	1675200	uma também,
1675200	1676160	por um ano anterior,
1676560	1676800	então,
1676800	1677760	que a gente pode criar uma coluna
1677760	1678480	para ver,
1678480	1680800	quanto que estava no ano anterior,
1680800	1681280	ou seja,
1681280	1682080	naquela mesma data,
1682080	1682800	no ano anterior,
1682800	1684000	quanto que tinha de jeito,
1684000	1684480	porque,
1684480	1684880	aí,
1684880	1685840	quando a gente compara
1685840	1686560	ano,
1686560	1687600	a gente já está
1687600	1688560	matando o efeito
1688560	1690000	sazonalidade com corno,
1690400	1690880	porque,
1690880	1691840	se eu analisar,
1691840	1692480	beleza,
1692480	1693440	está frio agora,
1693440	1694640	mas pode ser que está frio agora,
1694640	1695360	porque,
1695360	1696000	é,
1696000	1696800	de exemplo,
1697200	1697680	mas não é,
1697680	1698400	sinceramente,
1700000	1700880	está frio igual,
1700880	1701280	estava em,
1701280	1701520	de exemplo,
1701520	1702080	de ano passado,
1702080	1702560	com corno,
1702560	1703360	aqui também era
1703360	1704000	um veno,
1704000	1704720	enfim,
1704720	1705440	então você consegue
1705440	1706560	ver essa comparação,
1706560	1707120	é,
1707120	1708080	com base no período,
1708080	1709360	está frio agora,
1709360	1710000	em exemplo,
1710000	1711040	mas eu comparar com o julho,
1711040	1711520	com corno,
1711520	1712800	que não é o comparação injusto,
1712800	1713680	porque são,
1713680	1714880	estações diferentes,
1714880	1716400	então essa comparação
1716400	1717200	que a gente chama de ano,
1717200	1718000	contra ano,
1718000	1719360	ela é muito legal,
1719360	1720480	e às vezes mais robusto,
1720480	1721120	do que a comparação
1721120	1722000	meio escontranana,
1722000	1723520	eu escupo meio escontranês,
1723520	1724800	que a comparação meio escontranês,
1724800	1725920	se está pegando uma tendência,
1725920	1726640	de crescimento,
1726640	1727680	ou redução,
1727680	1728560	mas recente,
1728560	1729840	mas ano contra ano,
1729840	1731040	seja como essa tem um história,
1731040	1731680	tão robusto que eu
1731680	1732640	quando você é comparar
1732640	1733920	a sazonalidade,
1734240	1735680	do seu coge em de dados,
1735680	1736480	a gente pode ver aqui,
1736480	1737520	quando a gente pega comparação
1737520	1739360	no contrano de 2019,
1739360	1741600	é basicamente todos os dias
1741600	1743840	estava menor no ano anterior,
1743840	1744400	então,
1744400	1746800	ouvi uma redução
1746800	1749600	no julho na camada das perfísse de até.
1754560	1756160	Outro ponto aqui,
1756160	1757760	agora a gente vai começar a trabalhar
1757760	1759600	com datas e horas,
1759600	1761840	a gente viu aqui,
